{
  "schema_version": 1,
  "registry_version": "0.1.0",
  "last_updated": "2026-10-19",
  "entries": [
    {
      "id": "openai-chatgpt",
      "provider": { "id": "openai", "name": "OpenAI" },
      "product": "ChatGPT",
      "categories": ["hosted_chat", "multimodal"],
      "surfaces": ["web", "desktop"],
      "status": "active",
      "sources": [{ "url": "https://chatgpt.com/", "checked_on": "2026-10-19" }],
      "indicators": [{ "kind": "domain_exact", "value": "chatgpt.com", "confidence": "high", "actionability": "block_candidate", "source": { "url": "https://chatgpt.com/", "checked_on": "2026-10-19" }, "false_positive_notes": "Identifies the ChatGPT service hostname, not a particular user's intent. Apply only under an agreed policy; browser access to other domains or API routes may remain." }],
      "relationships": [],
      "notes": "Representative hosted product record; does not enumerate all OpenAI endpoints or client applications."
    },
    {
      "id": "openai-api",
      "provider": { "id": "openai", "name": "OpenAI" },
      "product": "OpenAI API",
      "categories": ["provider_api", "multimodal"],
      "surfaces": ["api", "cloud"],
      "status": "active",
      "sources": [{ "url": "https://platform.openai.com/docs/api-reference/introduction", "checked_on": "2026-10-19" }],
      "indicators": [{ "kind": "domain_exact", "value": "api.openai.com", "confidence": "high", "actionability": "block_candidate", "source": { "url": "https://platform.openai.com/docs/api-reference/introduction", "checked_on": "2026-10-19" }, "false_positive_notes": "The provider API hostname may serve multiple model and non-chat API operations. A destination match does not reveal request content or prove which feature was used." }],
      "relationships": [],
      "notes": "Exact provider API hostname from first-party API documentation."
    },
    {
      "id": "anthropic-claude",
      "provider": { "id": "anthropic", "name": "Anthropic" },
      "product": "Claude",
      "categories": ["hosted_chat", "multimodal"],
      "surfaces": ["web", "desktop"],
      "status": "active",
      "sources": [{ "url": "https://claude.ai/", "checked_on": "2026-10-19" }],
      "indicators": [{ "kind": "domain_exact", "value": "claude.ai", "confidence": "high", "actionability": "block_candidate", "source": { "url": "https://claude.ai/", "checked_on": "2026-10-19" }, "false_positive_notes": "Identifies the service hostname only. Alternate clients, regional routes, APIs, and gateways are separate surfaces." }],
      "relationships": [],
      "notes": "Web product indicator."
    },
    {
      "id": "anthropic-api",
      "provider": { "id": "anthropic", "name": "Anthropic" },
      "product": "Claude API",
      "categories": ["provider_api", "multimodal"],
      "surfaces": ["api", "cloud"],
      "status": "active",
      "sources": [{ "url": "https://platform.claude.com/docs/en/api/overview", "checked_on": "2026-10-19" }],
      "indicators": [{ "kind": "domain_exact", "value": "api.anthropic.com", "confidence": "high", "actionability": "block_candidate", "source": { "url": "https://platform.claude.com/docs/en/api/overview", "checked_on": "2026-10-19" }, "false_positive_notes": "Provider API host can serve multiple operations; traffic can also use gateways or custom proxies." }],
      "relationships": [],
      "notes": "Documented first-party API host."
    },
    {
      "id": "google-gemini",
      "provider": { "id": "google", "name": "Google" },
      "product": "Gemini web app",
      "categories": ["hosted_chat", "multimodal", "search_research"],
      "surfaces": ["web", "desktop"],
      "status": "active",
      "sources": [{ "url": "https://gemini.google.com/", "checked_on": "2026-10-19" }],
      "indicators": [{ "kind": "domain_exact", "value": "gemini.google.com", "confidence": "high", "actionability": "block_candidate", "source": { "url": "https://gemini.google.com/", "checked_on": "2026-10-19" }, "false_positive_notes": "Covers the web app hostname only; Google services may use other shared hosts and APIs." }],
      "relationships": [],
      "notes": "Hosted consumer product."
    },
    {
      "id": "google-gemini-api",
      "provider": { "id": "google", "name": "Google" },
      "product": "Gemini API",
      "categories": ["provider_api", "multimodal"],
      "surfaces": ["api", "cloud"],
      "status": "active",
      "sources": [{ "url": "https://ai.google.dev/gemini-api/docs/api-key", "checked_on": "2026-10-19" }],
      "indicators": [{ "kind": "domain_exact", "value": "generativelanguage.googleapis.com", "confidence": "high", "actionability": "block_candidate", "source": { "url": "https://ai.google.dev/gemini-api/docs/api-key", "checked_on": "2026-10-19" }, "false_positive_notes": "Specific API host from first-party documentation; APIs can be routed through other Google/cloud services or proxies." }],
      "relationships": [],
      "notes": "Does not include every Vertex AI or Google Cloud model deployment endpoint."
    },
    {
      "id": "xai-grok",
      "provider": { "id": "xai", "name": "xAI" },
      "product": "Grok",
      "categories": ["hosted_chat", "multimodal", "search_research"],
      "surfaces": ["web", "desktop"],
      "status": "active",
      "sources": [{ "url": "https://grok.com/", "checked_on": "2026-10-19" }],
      "indicators": [{ "kind": "domain_exact", "value": "grok.com", "confidence": "high", "actionability": "block_candidate", "source": { "url": "https://grok.com/", "checked_on": "2026-10-19" }, "false_positive_notes": "Identifies the public web product hostname only; other integrations may route through platform or API endpoints." }],
      "relationships": [],
      "notes": "Hosted product indicator."
    },
    {
      "id": "xai-api",
      "provider": { "id": "xai", "name": "xAI" },
      "product": "xAI API",
      "categories": ["provider_api", "multimodal"],
      "surfaces": ["api", "cloud"],
      "status": "active",
      "sources": [{ "url": "https://docs.x.ai/", "checked_on": "2026-10-19" }],
      "indicators": [{ "kind": "domain_exact", "value": "api.x.ai", "confidence": "high", "actionability": "block_candidate", "source": { "url": "https://docs.x.ai/", "checked_on": "2026-10-19" }, "false_positive_notes": "Documented API host; a provider API hostname may serve multiple model operations." }],
      "relationships": [],
      "notes": "First-party API documentation."
    },
    {
      "id": "deepseek-api",
      "provider": { "id": "deepseek", "name": "DeepSeek" },
      "product": "DeepSeek API",
      "categories": ["provider_api", "multimodal"],
      "surfaces": ["api", "cloud"],
      "status": "active",
      "sources": [{ "url": "https://api-docs.deepseek.com/guides/responses_api/", "checked_on": "2026-10-19" }],
      "indicators": [{ "kind": "domain_exact", "value": "api.deepseek.com", "confidence": "high", "actionability": "block_candidate", "source": { "url": "https://api-docs.deepseek.com/guides/responses_api/", "checked_on": "2026-10-19" }, "false_positive_notes": "First-party API host; custom endpoints and third-party gateways are outside this indicator." }],
      "relationships": [],
      "notes": "API-focused sample record."
    },
    {
      "id": "mistral-le-chat",
      "provider": { "id": "mistral", "name": "Mistral AI" },
      "product": "Le Chat",
      "categories": ["hosted_chat", "multimodal", "search_research"],
      "surfaces": ["web", "desktop"],
      "status": "active",
      "sources": [{ "url": "https://mistral.ai/products/le-chat", "checked_on": "2026-10-19" }],
      "indicators": [],
      "relationships": [],
      "notes": "Product included for ecosystem coverage; this sample does not assert a stable enforcement hostname."
    },
    {
      "id": "mistral-api",
      "provider": { "id": "mistral", "name": "Mistral AI" },
      "product": "Mistral API",
      "categories": ["provider_api", "multimodal"],
      "surfaces": ["api", "cloud"],
      "status": "active",
      "sources": [{ "url": "https://docs.mistral.ai/getting-started/quickstarts/developer/first-api-request", "checked_on": "2026-10-19" }],
      "indicators": [{ "kind": "domain_exact", "value": "api.mistral.ai", "confidence": "high", "actionability": "block_candidate", "source": { "url": "https://docs.mistral.ai/getting-started/quickstarts/developer/first-api-request", "checked_on": "2026-10-19" }, "false_positive_notes": "First-party API host; does not cover gateways, private deployments, or custom endpoints." }],
      "relationships": [],
      "notes": "Verified against first-party quickstart."
    },
    {
      "id": "huggingface-inference",
      "provider": { "id": "huggingface", "name": "Hugging Face" },
      "product": "Inference Providers",
      "categories": ["gateway", "cloud_marketplace", "router"],
      "surfaces": ["api", "cloud"],
      "status": "active",
      "sources": [{ "url": "https://huggingface.co/docs/inference-providers/index", "checked_on": "2026-10-19" }],
      "indicators": [{ "kind": "domain_exact", "value": "router.huggingface.co", "confidence": "high", "actionability": "block_candidate", "source": { "url": "https://huggingface.co/docs/inference-providers/index", "checked_on": "2026-10-19" }, "false_positive_notes": "Router hostname identifies an inference gateway but not the selected model/provider; Hugging Face also hosts non-inference services." }],
      "relationships": [],
      "notes": "Catalog/gateway surface routes requests to multiple inference providers."
    },
    {
      "id": "openrouter",
      "provider": { "id": "openrouter", "name": "OpenRouter" },
      "product": "OpenRouter API and model gateway",
      "categories": ["gateway", "router", "provider_api", "cloud_marketplace"],
      "surfaces": ["web", "api", "cloud"],
      "status": "active",
      "sources": [{ "url": "https://openrouter.ai/docs/api/api-reference/models/get-models", "checked_on": "2026-10-19" }],